title,lyrics
12-Bar Original," One, two, three, four! Embed"
"12-Bar Original (Take 2, Edited)",
1822!," This is a Dorsey Burnette number, brother of Johnny Burnette, called ""Lonesome Tears in My Eyes,"" recorded on their very first LP in 1822!  Ha!Embed"
A Beginning,
A Beginning (Take 4) / Don’t Pass Me By (Take 7)," This is the introduction to Ringo's ""Don't Pass Me By"" Take 4   I listen for your footsteps Coming up the drive Listen for your footsteps But they don't arrive Waiting for your knock dear On my old front door I don't hear it Does it mean you don't love me any more?  I hear the clock a'ticking On the mantle shelf See the hands a'moving But I'm by myself I wonder where you are tonight And why I'm by myself I don't see you Does it mean you don't love me any more? Don't pass me by Don't make me cry Don't make me blue 'Cause you know, darling, I love only you You'll never know it hurt me so I hate to see you go Don't pass me by Don't make me cry  I'm sorry that I doubted you I was so unfair You were in a car crash And you lost your hair You said that you would be late About an hour or two I said that's alright I'm waiting here Just waiting to hear from you  Don't pass me by Don't make me cry Don't make me blue 'Cause you know, darling, I love only you You'll never know it hurt me so I hate to see you go Don't pass me by Don't make me cry I listen for your footsteps Coming up the drive Listen for your footsteps But they don't arrive Waiting for your knock dear On my old front door I don't hear it Does it mean you don't love me any more?  Don't pass me by Don't make me cry Don't make me blue 'Cause you know, darling, I love only you You'll never know it hurt me so I hate to see you go Don't pass me by Don't make me cry  I'm waiting for you, honey Hurry up to me I don't want you to pass me by I don't want you to make me cry I want you to make me happy Happy, happy 'Cause that's what I want This is so friendly This is so friendly This is so friendlyEmbed"
Across the Universe," Words are flowing out like endless rain into a paper cup They slither wildly as they slip away across the universe Pools of sorrow, waves of joy are drifting through my opened mind Possessing and caressing me  Jai Guru Deva, Om Nothing's gonna change my world Nothing's gonna change my world Nothing's gonna change my world Nothing's gonna change my world  Images of broken light which dance before me like a million eyes They call me on and on across the universe Thoughts meander like a restless wind inside a letter box They tumble blindly as they make their way across the universe  Jai Guru Deva, Om Nothing's gonna change my world Nothing's gonna change my world Nothing's gonna change my world Nothing's gonna change my world Sounds of laughter, shades of life are ringing through my open ears Inciting and inviting me Limitless undying love which shines around me like a million suns It calls me on and on across the universe  Jai Guru Deva, Om Nothing's gonna change my world Nothing's gonna change my world Nothing's gonna change my world Nothing's gonna change my world  Jai Guru Deva Jai Guru Deva Jai Guru Deva Jai Guru Deva Jai Guru Deva Jai Guru Deva48Embed"
Across the Universe (Take 2)," Words are flowing out like endless rain into a paper cup They slither while they pass, they slip away across the universe Pools of sorrow, waves of joy are drifting through my opened mind Possessing and caressing me  Jai Guru Deva, Om Nothing's gonna change my world Nothing's gonna change my world Nothing's gonna change my world Nothing's gonna change my world  Images of broken light which dance before me like a million eyes They call me on and on across the universe Thoughts meander like a restless wind inside a letter box They tumble blindly as they make their way across the universe  Jai Guru Deva, Om Nothing's gonna change my world Nothing's gonna change my world Nothing's gonna change my world Nothing's gonna change my world Sounds of laughter, shades of life are ringing through my open ears Inciting and inviting me Limitless undying love which shines around me like a million suns It calls me on and on across the universe  Jai Guru Deva, Om Nothing's gonna change my world Nothing's gonna change my world Nothing's gonna change my world Nothing's gonna change my world  Jai Guru Deva Jai Guru Deva Jai Guru DevaEmbed"
Across the Universe (Take 6)," Words are flowing out like endless rain into a paper cup They slither while they pass, they slip away across the universe Pools of sorrow, waves of joy are drifting through my opened mind Possessing and caressing me  Jai Guru Deva, Om Nothing's gonna change my world Nothing's gonna change my world Nothing's gonna change my world Nothing's gonna change my world  Images of broken light which dance before me like a million eyes They call me on and on across the universe Thoughts meander like a restless wind inside a letter box They tumble blindly as they make their way across the universe  Jai Guru Deva, Om Nothing's gonna change my world Nothing's gonna change my world Nothing's gonna change my world Nothing's gonna change my world Sounds of laughter, shades of life are ringing through my open ears Inciting and inviting me Limitless undying love which shines around me like a million suns It calls me on and on across the universe  Jai Guru Deva, Om Nothing's gonna change my world Nothing's gonna change my world Nothing's gonna change my world Nothing's gonna change my world  Jai Guru Deva Jai Guru Deva Jai Guru DevaEmbed"
Act Naturally," They're gonna put me in the movies They're gonna make a big star out of me We'll make a film about a man that's sad and lonely And all I gotta do is act naturally  Well I'll bet you I'm gonna be a big star Might win an Oscar, you can never tell The movies gonna make me a big star 'Cause I can play the part so well  Well I hope you'll come and see me in the movies Then I know that you will plainly see The biggest fool that ever hit the big time And all I gotta do is act naturally  We'll make the scene about a man that's sad and lonely And begging down upon his bended knee I'll play the part and I won't need rehearsing All I have to do is act naturally  Well I'll bet you I'm gonna be a big star Might win an Oscar, you can never tell The movies gonna make me a big star 'Cause I can play the part so well Well I hope you'll come and see me in the movies Then I know that you will plainly see The biggest fool that ever hit the big time And all I gotta do is act naturally4Embed"
A Day in the Life," I read the news today—oh, boy About a lucky man who made the grade And though the news was rather sad Well, I just had to laugh I saw the photograph He blew his mind out in a car He didn't notice that the lights had changed A crowd of people stood and stared They'd seen his face before Nobody was really sure if he was from the House of Lords  I saw a film today, oh boy The English Army had just won the war A crowd of people turned away But I just had to look Having read the book  I'd love to turn you on (Seven, Eight, Nine, Ten) *alarm clock rings* Woke up, fell out of bed Dragged a comb across my head Found my way downstairs and drank a cup And looking up I noticed I was late Found my coat and grabbed my hat Made the bus in seconds flat Found my way upstairs and had a smoke And somebody spoke and I went into a dream Ahh-ah-ah-ah Ah-ah-ah, ah-ah-ahh  I read the news today—oh, boy Four thousand holes in Blackburn, Lancashire And though the holes were rather small They had to count them all Now they know how many holes it takes to fill the Albert Hall  I'd love to turn you on *whistle* *studio chatter*70Embed"
A Day in the Life (Take 1 with Hums)," Geoff Emerick: ""In the Life Of"", Take 1 John: Dab the mic on the piano, and quite low, this, just keep it in like, maracas you know. You know those old pianos John:  Okay we're on. Mouth John: Sugarplum fairy, sugarplum fairy  I read the news today, oh boy About a lucky man who made the grade And though the news was rather sad Well I just had to laugh I saw the photograph  He blew his mind out in a car He didn't notice that the lights had changed A crowd of people stood and stared They'd seen his face before Nobody was really sure if he was from the House of Lords  I saw a film today, oh, boy The English Army had just won the war A crowd of people turned away But I just had to look Having read the book I'd love to turn you on Three, four, five, six, seven, eight, nine, ten, eleven, twelve, thirteen, fourteen, fifteen, sixteen, seventeen, eighteen, nineteen, twenty   I read the news today, oh boy Four-thousand holes in Blackburn, Lancashire And though the holes were rather small They had to count them all Now they know how many holes it takes to fill the Albert Hall I'd love to turn you on  Three, four, five, six, seven, eight, nine, ten, eleven, twelve, thirteen, fourteen, fifteen, sixteen, seventeen, eighteen, nineteen, twenty UmmEmbed"
A Day in the Life (Take 2),"Take 2! John: 1, 2, 3, 4....  I read the news today, oh boy About a lucky man who made the grade And though the news was rather sad Well, I just had to laugh I saw the photograph He blew his mind out in a car He didn't notice that the lights had changed A crowd of people stood and stared They'd seen his face before Nobody was really sure if he was from the House of Lords  I saw a film today, oh boy The English Army had just won the war A crowd of people turned away But I just had to look Having read the book I'd love to turn you on  I read the news today, oh boy 4,000 holes in Blackburn, Lancashire And though the holes were rather small They had to count them all Now they know how many holes it takes to fill the Albert Hall I'd love to turn you on Embed"
"A Day In the Life (Takes 1, 2, 6 and Orchestra)"," ""Dub the mic on the piano quite low this Just keeping it like maracas, you know You know those old pianos"" ""Ok, we're on"" ""Sugarplum fairy, sugarplum fairy"" I read the news today, oh boy About a lucky man who made the grade And though the news was rather sad Well, I just had to laugh I saw the photograph He blew his mind out in a car He didn't notice that the lights had changed A crowd of people stood and stared They'd seen his face before Nobody was really sure if he was from the House of Lords I saw a film today, oh boy The English Army had just won the war A crowd of people turned away But I just had to look Having read the book I'd love to turn you on ""Five, six, seven, eight, nine Ten, eleven, twelve, thirteen, fourteen Fifteen, sixteen, seventeen, eighteen, nineteen Twenty"" Woke up, fell out of bed Dragged a comb across my head Found my way downstairs and drank a cup And looking up I noticed I was late Found my coat and grabbed my hat Made the bus in seconds flat Made my way upstairs and had a smoke And everybody spoke and I went into a dream ""Oh shit"" I read the news today, oh boy Four thousand holes in Blackburn, Lancashire And though the holes were rather small They had to count them all Now they know how many holes it takes to fill the Albert Hall I'd love to turn you ""See the worst thing about doing this Doing something like this Is I think that at first people sort of are a bit suspicious 'You know, come on, what are you up to?'Embed"
A Hard Day’s Night," It's been a hard day's night And I've been working like a dog It's been a hard day's night I should be sleeping like a log But when I get home to you I find the things that you do Will make me feel alright  You know I work all day To get you money to buy you things And it's worth it just to hear you say You're gonna give me everything So why on earth should I moan 'Cause when I get you alone You know I feel okay  When I'm home, everything seems to be right When I'm home feeling you holding me tight Tight, yeah!  It's been a hard day's night And I've been working like a dog It's been a hard day's night I should be sleeping like a log But when I get home to you I find the things that you do Will make me feel alright Ah!  So why on earth should I moan 'Cause when I get you alone You know I feel okay  When I'm home everything seems to be right When I'm home feeling  you holding me tight Tight, yeah!  It's been a hard day's night And I've been working like a dog It's been a hard day's night I should be sleeping like a log But when I get home to you I find the things that you do Will make me feel alright  You know I feel alright You know I feel alright17Embed"
A Hard Day’s Night [Live at the BBC Disk 2]," It's been a hard day's night And I've been working like a dog It's been a hard day's night I should be sleeping like a log But when I get home to you I find the things that you do Will make me feel alright  You know I work all day To get you money to buy you things And it's worth it just to hear you say You're gonna give me everything So why on earth should I moan 'Cause when I get you alone You know I feel okay  When I'm home everything seems to be right When I'm home feeling you holding me tight, tight, yeah  It's been a hard day's night And I've been working like a dog It's been a hard day's night I should be sleeping like a log But when I get home to you I find the things that you do Will make me feel alright Ah!   So why on earth should I moan 'Cause when I get you alone You know I feel okay  When I'm home everything seems to be right When I'm home feeling you holding me tight, tight, yeh  It's been a hard day's night And I've been working like a dog It's been a hard day's night I should be sleeping like a log But when I get home to you I find the things that you do Will make me feel alright You know I feel alright You know I feel alrightEmbed"
A Hard Day’s Night [Live at the Hollywood Bowl]," It's been a hard day's night And I've been working like a dog It's been a hard day's night I should be sleeping like a log But when I get home to you I find the things that you do Will make me feel alright  You know I work all day To get you money to buy you things And it's worth it just to hear you say You're gonna give me everything So why on earth should I moan 'Cause when I get you alone You know I feel okay  When I'm home everything seems to be right When I'm home feeling you holding me tight, tight, yeah  It's been a hard day's night And I've been working like a dog It's been a hard day's night I should be sleeping like a log But when I get home to you I find the things that you do Will make me feel alright Ah!  So why on earth should I moan 'Cause when I get you alone You know I feel okay  When I'm home everything seems to be right When I'm home feeling you holding me tight, tight, yeh  It's been a hard day's night And I've been working like a dog It's been a hard day's night I should be sleeping like a log But when I get home to you I find the things that you do Will make me feel alright You know I feel alright You know I feel alrightEmbed"
Ain’t Nothing Shakin’ (But The Leaves)," I found it out, what love is all about And every day, it sure lets out I see my baby, I get weak in the knees 'Cause nothin's shakin' but the leaves on the tree My papi told me there'd be times like these There's nothin' shakin' but the leaves on the trees  We meet the gang and go to rockin' Joe's The cats are something on the heels and toes I grab my baby, tried to give her a squeeze There's nothin' shakin' but the leaves on the trees Well why must she be such a dog-gone tease? There's nothin' shakin' but the leaves on the trees  She's got a way that makes me act like a fool Spent my money, then she plays me cool I'm beggin' for her kisses on a bended knee Oh, won't you give me some-a lovin', baby Please, please, please  Though I keep trying hard to make her mine One day the wind will blow, the sun will shine Till that time, she puts my heart at ease There's nothin' shakin' but the leaves on the trees She locked my heart and threw away the keys There's nothin' shakin' but the leaves on the trees, yeah  She's got a way that makes me act like a fool Spent my money, then she plays me cool I'm beggin' for her kisses on a bended knee Oh, won't you give me some-a lovin', baby Please, please, please  Though I keep trying hard to make her mine One day the wind will blow, the sun will shine Till that time, she puts my heart at ease There's nothin' shakin' but the leaves on the trees She locked my heart and threw away the keys There's nothin' shakin' but the leaves on the trees There's nothin' shakin' but the leaves on the trees There's nothin' shakin' but the leaves on the trees There's nothin' shakin' but the leaves on the treesEmbed"
Ain’t She Sweet (John Lennon vocal),Edit 
A Little Rhyme,"  Now, for the final number, John's got a card in his hand with a little rhyme on it. What is it?  It's from the form up a third at Hemel Hempstead  Oh!  It says, ""Dear George, John, Ringo, Paul, here's hoping that you'll please us all A beauty song and swinging voice, we leave it up to you, the choice We think you're fab and really cool, so brighten up our lads at school"" Dig this, for here's Paul, whistling ""Clarabella""Embed"
"A Little Rhyme (Live at the BBC for “Pop Go The Beatles” / 16th July, 1963)","  Now, for the final number, John's got a card in his hand with a little rhyme on it. What is it?  It's from the form up a third at Hemel Hempstead  Oh!  It says, ""Dear George, John, Ringo, Paul, here's hoping that you'll please us all A beauty song and swinging voice, we leave it up to you, the choice We think you're fab and really cool, so brighten up our lads at school"" Dig this, for here's Paul, whistling ""Clarabella""Embed"
All I’ve Got to Do," Whenever I want you around, yeah All I got to do Is call you on the phone And you'll come running home Yeah, that's all I got to do  And when I, I want to kiss you, yeah All I got to do Is whisper in your ear The words you long to hear And I'll be kissin' you  And the same goes for me Whenever you want me at all I'll be here, yes, I will Whenever you call You just got to call on me, yeah You just got to call on me  And when I, I want to kiss you, yeah All I got to do Is call you on the phone And you'll come runnin' home Yeah, that's all I got to do And the same goes for me Whenever you want me at all I'll be here, yes, I will Whenever you call You just got to call on me, yeah You just got to call on me6Embed"
All My Loving," Close your eyes and I'll kiss you Tomorrow I'll miss you Remember I'll always be true And then while I'm away I'll write home everyday And I'll send all my loving to you  I'll pretend that I'm kissing The lips I am missing And hope that my dreams will come true And then while I'm away I'll write home everyday And I'll send all my loving to you  All my loving I will send to you All my loving, darling, I'll be true  Close your eyes and I'll kiss you Tomorrow I'll miss you Remember I'll always be true And then while I'm away I'll write home everyday And I'll send all my loving to you All my loving I will send to you All my loving, darling, I'll be true All my loving, all my loving, ooh All my loving I will send to you12Embed"
All My Loving [Live at the BBC Disk 2]," Close your eyes and I'll kiss you Tomorrow I'll miss you Remember I'll always be true And then while I'm away I'll write home everyday And I'll send all my loving to you  I'll pretend that I'm kissing The lips I am missing And hope that my dreams will come true And then while I'm away I'll write home everyday And I'll send all my loving to you  All my loving I will send to you All my loving, darling I'll be true  Close your eyes and I'll kiss you Tomorrow I'll miss you Remember I'll always be true And then while I'm away I'll write home everyday And I'll send all my loving to you  All my loving I will send to you All my loving, darling I'll be true All my loving, all my loving ooh All my loving I will send to youEmbed"
All My Loving [Live at the Hollywood Bowl]," Close your eyes and I'll kiss you Tomorrow I'll miss you Remember I'll always be true And then while I'm away I'll write home everyday And I'll send all my loving to you  I'll pretend that I'm kissing The lips I am missing And hope that my dreams will come true And then while I'm away I'll write home everyday And I'll send all my loving to you  All my loving I will send to you All my loving, darling I'll be true  Close your eyes and I'll kiss you Tomorrow I'll miss you Remember I'll always be true And then while I'm away I'll write home everyday And I'll send all my loving to you All my loving I will send to you All my loving, darling I'll be true All my loving, all my loving ooh All my loving I will send to youEmbed"
All Things Must Pass (Demo), Sunrise doesn't last all morning A cloudburst doesn't last all day Seems my love is up And has left you with no warning But it's not always going to be this grey  All things must pass All things must pass away  Sunset doesn't last all evening A mind can blow those clouds away After all this my love is up And must be leaving It has not always been this grey  All things must pass All things must pass away  All things must pass None of life's strings can last So I must be on my way And face another day Now the darkness only stays at nighttime In the morning it will fade away Daylight is good At arriving at the right time It's not always going to be this grey  All things must pass All things must pass away All things must pass All things must pass awayEmbed
All Together Now," One, two, three, four Can I have a little more? Five, six, seven, eight, nine, ten, I love you  A, B, C, D Can I bring my friend to tea? E, F, G, H, I, J, I love you  (Bom bom bom bompa bom) Sail the ship (Bompa bom) Chop the tree (Bompa bom) Skip the rope (Bompa bom) Look at me  (All together now) All together now (All together now) All together now (All together now) All together now (All together now) All together now  Black, white, green, red Can I take my friend to bed? Pink, brown, yellow, orange and blue, I love you (All together now) All together now (All together now) All together now (All together now) All together now (All together now) All together now (All together now) All together now (All together now) All together now (All together now) All together now (All together now) All together now (All together now) All together now (All together now) All together now (All together now) All together now (All together now) All together now (All together now) All together now (All together now) All together now (All together now) All together now (All together now) All together now  (Bom bom bom bompa bom) Sail the ship (Bompa bom) Chop the tree (Bompa bom) Skip the rope (Bompa bom) Look at me  (All together now) All together now (All together now) All together now (All together now) All together now (All together now) All together now (All together now) All together now (All together now) All together now (All together now) All together now (All together now) All together now (All together now) All together now (All together now) All together now (All together now) All together now (All together now) All together now (All together now) All together now (All together now) All together now (All together now) All together now (All together now) All together now (All together now) All together now (All together now) All together now (All together now) All together now (All together now) All together now (All together now) All together now (All together now) All together now (All together now) All together now (All together now) All together now (All together now) All together now (All together now) All together now (All together now) All together now (All together now) All together now1Embed"
All Together on the Wireless Machine,When I was sitting on my piano one day A magical thought came my way To write a number for the BBC Kenny Everett McCartney All together on the wireless machine Kenny Everett McCartney All together on the wireless machine Kenny Everett McCartney All together on the wireless machineEmbed
All You Need Is Love," Love, love, love Love, love, love Love, love, love  There's nothing you can do that can't be done Nothing you can sing that can't be sung Nothing you can say, but you can learn how to play the game It's easy  Nothing you can make that can't be made No one you can save that can't be saved Nothing you can do, but you can learn how to be you in time It's easy  All you need is love All you need is love All you need is love, love Love is all you need  Love, love, love Love, love, love Love, love, love All you need is love All you need is love All you need is love, love Love is all you need  There's nothing you can know that isn't known Nothing you can see that isn't shown There's nowhere you can be that isn't where you're meant to be It's easy  All you need is love All you need is love All you need is love, love Love is all you need  All you need is love (All together now) All you need is love (Everybody) All you need is love, love Love is all you need (Yesterday) (Oh yeah) (She loves you, yeah, yeah, yeah) (She loves you, yeah, yeah, yeah) (Oh, yesterday)17Embed"
And Here We Are Again,"And Here we are again with another half hour of the 1963 sound with The Beatles, That's John Lennon, Paul McCartney, George Harrison and Ringo Starr and who are you my man, I thought you’d never ask. My name's Rodney Burke thank you very much, that's your fault!Embed"
